{
  "availability": {
    "status": "available",
    "present": [],
    "missing": [],
    "note": null
  },
  "primary": {
    "representation": "master-detail",
    "interaction": [
      "search-focus",
      "filter",
      "linked-highlighting",
      "details-on-demand",
      "provenance-inspector"
    ],
    "implementation": {
      "renderer": "native-web",
      "layout": null,
      "notes": [
        "supports application-ui (+7)",
        "low-dependency baseline (+3)"
      ],
      "playbook": {
        "id": "responsive-application-composition",
        "buildSteps": [
          "establish-primary-task-and-panel-hierarchy",
          "design-target-width-breakpoints",
          "use-minmax-and-content-aware-sizing",
          "keep-details-from-obscuring-primary-context",
          "test-empty-normal-and-max-content",
          "verify-keyboard-and-focus-order",
          "run-render-quality-gate"
        ],
        "avoid": [
          "fixed-desktop-panel-widths",
          "page-level-horizontal-scroll",
          "secondary-panels-dominating-primary-task"
        ]
      }
    }
  },
  "alternatives": [
    "schema-explorer",
    "data-table",
    "composite-linked-view"
  ],
  "alternativesDetailed": [
    {
      "representation": "schema-explorer",
      "relationshipToPrimary": "unclassified",
      "reason": "No reviewed substitute/complement relation is recorded for this pair yet."
    },
    {
      "representation": "data-table",
      "relationshipToPrimary": "unclassified",
      "reason": "No reviewed substitute/complement relation is recorded for this pair yet."
    },
    {
      "representation": "composite-linked-view",
      "relationshipToPrimary": "substitute",
      "reason": "Use the composite only when several complementary operations are first-class; otherwise a simpler collection plus inspector is cheaper."
    }
  ],
  "avoid": [],
  "rationale": [
    "structure: table, hierarchy (+10)",
    "intent: inspect, navigate (+6)",
    "task: lookup, filter, inspect (+12)",
    "interaction: exploratory (+2)",
    "dynamics: interactive (+3)",
    "density: medium (+2)",
    "supports provenance (+2)",
    "strong accessibility fit (+1)",
    "strong mobile fit (+1)"
  ],
  "assumptions": [],
  "interfacePatterns": [
    {
      "id": "requirement-to-evidence-traceability",
      "title": "Requirement-to-evidence assurance map",
      "family": "assurance",
      "score": 21,
      "reason": "supports filter, compare, inspect; serves inspect, compare; fits table",
      "apply": [
        "Trace each criterion to architecture, work, and evidence",
        "Distinguish covered, partial, and missing",
        "Keep assessor questions next to the criterion",
        "Separate machine checks from human acceptance"
      ],
      "avoid": [
        "Using a single completion percentage",
        "Treating test presence as proof of the requirement",
        "Hiding unknowns in footnotes"
      ],
      "implementationHints": [
        "traceability-matrix",
        "coverage-state",
        "assessor-question",
        "linked-inspector"
      ],
      "sources": [
        {
          "name": "GOV.UK check answers",
          "url": "https://design-system.service.gov.uk/patterns/check-answers/",
          "role": "review-structure-reference"
        },
        {
          "name": "GitHub checks",
          "url": "https://docs.github.com/en/rest/checks",
          "role": "evidence-status-reference"
        }
      ]
    },
    {
      "id": "implementation-conformance-review",
      "title": "Plan-to-code conformance review",
      "family": "review",
      "score": 17,
      "reason": "supports compare, inspect; serves inspect, compare; fits table",
      "apply": [
        "Name the planned obligation that changed",
        "Link changed artifacts and exact revision",
        "Show checks and observed behavior separately",
        "Surface drift and non-claims before approval"
      ],
      "avoid": [
        "Reviewing code without the intended architecture",
        "Equating passing tests with conformance",
        "Showing a diff without the requirement it is meant to satisfy"
      ],
      "implementationHints": [
        "architecture-diff",
        "changed-artifact-list",
        "evidence-grade",
        "review-disposition"
      ],
      "sources": [
        {
          "name": "GitHub pull request reviews",
          "url": "https://docs.github.com/en/pull-requests/reference/pull-request-reviews",
          "role": "review-interaction-reference"
        },
        {
          "name": "arc42 quality requirements",
          "url": "https://docs.arc42.org/section-10/",
          "role": "architecture-quality-reference"
        }
      ]
    },
    {
      "id": "primary-detail-inspector",
      "title": "Stable overview with detail inspector",
      "family": "progressive-disclosure",
      "score": 17,
      "reason": "supports compare, inspect; serves navigate, inspect; fits table",
      "apply": [
        "Persist selection",
        "Lead with the decision-relevant summary",
        "Step down to evidence and source",
        "Keep close and keyboard navigation explicit"
      ],
      "avoid": [
        "Opening a new page for every detail",
        "Showing internal IDs before human-readable meaning",
        "Relying on hover"
      ],
      "implementationHints": [
        "details-on-demand",
        "linked-highlighting",
        "provenance-inspector"
      ],
      "sources": [
        {
          "name": "PatternFly primary-detail",
          "url": "https://www.patternfly.org/patterns/primary-detail/design-guidelines/",
          "role": "behavior-reference"
        },
        {
          "name": "Carbon disclosure patterns",
          "url": "https://carbondesignsystem.com/patterns/overview/",
          "role": "behavior-reference"
        }
      ]
    },
    {
      "id": "review-before-completion",
      "title": "Review before completion",
      "family": "review",
      "score": 17,
      "reason": "supports compare, inspect; serves inspect, compare; fits table",
      "apply": [
        "Show what changed",
        "Bind evidence to the exact revision",
        "Separate pass evidence from limitations",
        "Offer approve and request-changes dispositions"
      ],
      "avoid": [
        "Equating green tests with human acceptance",
        "Making the reviewer reconstruct the change from raw files",
        "Hiding non-claims"
      ],
      "implementationHints": [
        "diff-summary",
        "evidence-links",
        "disposition-controls",
        "details-on-demand"
      ],
      "sources": [
        {
          "name": "GitHub pull request reviews",
          "url": "https://docs.github.com/en/pull-requests/reference/pull-request-reviews",
          "role": "interaction-model"
        },
        {
          "name": "GOV.UK check answers",
          "url": "https://design-system.service.gov.uk/patterns/check-answers/",
          "role": "behavior-reference"
        }
      ]
    },
    {
      "id": "dashboard-progressive-disclosure",
      "title": "Overview first, evidence on demand",
      "family": "dashboard-composition",
      "score": 14,
      "reason": "supports filter, inspect; serves navigate; fits table",
      "apply": [
        "Reserve the first screen for status and decisions",
        "Use parameters to reduce density",
        "Make update time visible",
        "Coordinate overview and detail selection"
      ],
      "avoid": [
        "A wall of equally weighted cards",
        "Decorative metrics",
        "Requiring scrolling before the active decision is visible"
      ],
      "implementationHints": [
        "overview-detail",
        "filter",
        "linked-highlighting",
        "freshness-label"
      ],
      "sources": [
        {
          "name": "Dashboard Design Patterns",
          "url": "https://dashboarddesignpatterns.github.io/patterns.html",
          "role": "research-pattern-library"
        },
        {
          "name": "The Component Gallery",
          "url": "https://component.gallery/",
          "role": "cross-system-example-index"
        }
      ]
    }
  ],
  "quality": {
    "method": "application-layout-quality",
    "workflow": [
      "layout-at-target-widths",
      "measure-control-and-text-bounds",
      "check-scroll-containment",
      "check-focus-order",
      "check-empty-and-max-content",
      "human-composition-review",
      "capture-visual-regression"
    ],
    "hardChecks": [
      "no-control-overlap",
      "no-page-level-horizontal-overflow",
      "keyboard-reachable-controls",
      "persistent-selection-visible"
    ],
    "softChecks": [
      "balanced-panel-sizing",
      "clear-primary-action",
      "details-do-not-obscure-context",
      "first-frame-legibility"
    ],
    "usabilityChecks": [],
    "repairOrder": [
      "reflow-layout",
      "allocate-minmax-space",
      "wrap-or-truncate-secondary-text",
      "move-detail-to-drawer-or-inspector"
    ]
  },
  "viewSpec": {
    "version": "0.1",
    "id": "ui-atlas-index--master-detail",
    "concern": "Which user interfaces does the owner have across all projects, which are current versus old, and how does he open a given one?",
    "viewpoint": {
      "stakeholder": "owner looking for a specific UI or surveying what exists",
      "intent": [
        "navigate",
        "inspect",
        "compare"
      ],
      "tasks": [
        "lookup",
        "filter",
        "compare",
        "inspect"
      ],
      "audience": {
        "expertise": "novice",
        "frequency": "occasional"
      }
    },
    "representationContext": {
      "role": null,
      "abstractionLevel": null,
      "concernHierarchy": null
    },
    "availability": {
      "status": "available",
      "present": [],
      "missing": [],
      "note": null
    },
    "projection": {
      "entities": [